train,stations
train_1,"[Dordrecht, Rotterdam Centraal, Dordrecht, Rotterdam Centraal, Rotterdam Alexander, Gouda, Den Haag Centraal, Leiden Centraal, Schiphol Airport, Amsterdam Zuid]"
train_2,"[Haarlem, Beverwijk, Zaandam, Beverwijk, Castricum]"
train_3,"[Amsterdam Sloterdijk, Amsterdam Centraal, Amsterdam Amstel, Amsterdam Zuid, Amsterdam Sloterdijk, Amsterdam Zuid, Amsterdam Amstel, Amsterdam Centraal, Amsterdam Sloterdijk, Haarlem, Heemstede-Aerdenhout, Leiden Centraal]"
train_4,"[Alkmaar, Castricum, Zaandam, Hoorn, Zaandam, Beverwijk, Castricum, Alkmaar]"
train_5,"[Amsterdam Centraal, Amsterdam Sloterdijk, Amsterdam Centraal, Amsterdam Sloterdijk, Haarlem, Beverwijk, Zaandam, Beverwijk, Haarlem]"
train_6,"[Amsterdam Amstel, Amsterdam Centraal, Amsterdam Sloterdijk, Haarlem, Beverwijk, Castricum, Alkmaar, Castricum, Beverwijk, Zaandam]"
train_7,"[Delft, Schiedam Centrum, Rotterdam Centraal, Rotterdam Alexander, Gouda, Rotterdam Alexander, Rotterdam Centraal, Schiedam Centrum, Rotterdam Centraal, Schiedam Centrum, Rotterdam Centraal, Dordrecht, Rotterdam Centraal, Rotterdam Alexander, Gouda]"
score,6387.142857142857
