train, stations
"train_1,""[Amsterdam Amstel, Amsterdam Zuid, Schiphol Airport, Leiden Centraal, Heemstede-Aerdenhout, Haarlem, Beverwijk, Castricum, Alkmaar, Hoorn]"""
"train_2,""[Haarlem, Beverwijk, Zaandam, Castricum, Alkmaar, Den Helder]"""
"train_3,""[Hoorn, Zaandam, Amsterdam Sloterdijk, Amsterdam Centraal, Amsterdam Amstel, Amsterdam Zuid, Amsterdam Sloterdijk, Haarlem]"""
"train_4,""[Rotterdam Centraal, Dordrecht]"""
"train_5,""[Gouda, Rotterdam Alexander, Rotterdam Centraal, Schiedam Centrum, Delft, Den Haag Centraal, Gouda, Alphen a/d Rijn, Leiden Centraal, Den Haag Centraal]"""
score,9210.0
