train,stations
train_1,"[Gouda, Den Haag Centraal, Delft, Den Haag Centraal, Delft, Den Haag Centraal, Leiden Centraal, Den Haag Centraal, Delft, Den Haag Centraal]"
train_2,"[Leiden Centraal, Alphen a/d Rijn, Leiden Centraal, Schiphol Airport, Leiden Centraal, Den Haag Centraal, Delft, Den Haag Centraal, Leiden Centraal]"
train_3,"[Dordrecht, Rotterdam Centraal, Rotterdam Alexander, Rotterdam Centraal, Schiedam Centrum, Delft, Schiedam Centrum, Delft, Den Haag Centraal, Gouda, Den Haag Centraal, Leiden Centraal]"
train_4,"[Den Helder, Alkmaar, Den Helder, Alkmaar]"
train_5,"[Alphen a/d Rijn, Gouda, Den Haag Centraal, Leiden Centraal]"
train_6,"[Alkmaar, Den Helder, Alkmaar]"
train_7,"[Haarlem, Amsterdam Sloterdijk]"
score, 5854.857142857143
