train,stations
"train_1,""[Den Helder, Alkmaar, Castricum, Beverwijk, Haarlem, Amsterdam Sloterdijk, Zaandam, Castricum]"""
"train_2,""[Dordrecht, Rotterdam Centraal, Schiedam Centrum, Delft, Den Haag Centraal, Gouda, Alphen a/d Rijn, Leiden Centraal, Heemstede-Aerdenhout, Haarlem]"""
"train_3,""[Amsterdam Zuid, Amsterdam Sloterdijk, Amsterdam Centraal, Amsterdam Amstel, Amsterdam Zuid, Schiphol Airport, Leiden Centraal, Den Haag Centraal, Gouda, Rotterdam Alexander, Rotterdam Centraal]"""
"train_4,""[Beverwijk, Zaandam, Hoorn, Alkmaar]"""
score,9201.0
